question_id,question,choices,correct_answers,rationale,difficulty
13294295,"The graph shown models the number of candy bars a certain machine wraps with a label in  seconds. 
 According to the graph, what is the estimated number of candy bars the machine wraps with a label per second?","['A. ', 'B. ', 'C. ', 'D. ID: 13294295 Answer']",['B'],,
ed92fb68,"If the system of equations above has solution 
,
what is the value of 
 ?","['A. 0', 'B. 9', 'C. 18', 'D. 38']",['C'],,
1a621af4,"A number  is at most  less than  times the value of . If the value of  is 
, what is the greatest possible value of ?
ID: 1a621af4 Answer",[],['-14'],,
3e9eaffc,"Caleb used juice to make popsicles. The function 
 approximates the volume, in ﬂuid ounces, of juice
Caleb had remaining after making  popsicles. Which statement is the best interpretation of the y-intercept of the graph of 
 in the xy-plane in this context?","['A. Caleb used approximately  ﬂuid ounces of juice for each popsicle.', 'B. Caleb had approximately  ﬂuid ounces of juice when he began to make the popsicles.', 'C. Caleb had approximately \n ﬂuid ounces of juice when he began to make the popsicles.', 'D. Caleb used approximately ']",['C'],,
af2ba762,"According to data provided by the US Department of Energy, the average price per gallon of regular gasoline in the
United States from September 1, 2014, to December 1, 2014, is modeled by the function F deﬁned below, where 
 is
the average price per gallon x months after September 1.
The constant 2.74 in this function estimates which of the following?","['A. The average monthly decrease in the price per gallon', 'B. The difference in the average price per gallon from September\xa01,\xa02014, to December\xa01,\xa02014', 'C. The average price per gallon on September 1, 2014', 'D. The average price per gallon on December 1, 2014']",['D'],,
19fdf387,"In the xy-plane, the graph of 
 intersects the graph of 
 at
the point 
. What is the value of a ?","['A. 3', 'B. 6', 'C. 9', 'D. 12']",['C'],,
a775af14,"In the xy-plane, the graph of the linear function  contains the points 
 and 
. Which equation deﬁnes , where
?","['A. ', 'B. ', 'C. ', 'D. ID: a775af14 Answer']",['C'],,
db0107df,"The y-intercept of the graph of 
 in the xy-plane is 
. What is the value of ?
ID: db0107df Answer",[],['9'],,
b9835972,"In the xy-plane, line  passes through the point 
 and is parallel to the line represented by the equation 
. If
line  also passes through the point 
, what is the value of ?
ID: b9835972 Answer",[],['24'],,
df32b09c,"Tom scored 85, 78, and 98 on his ﬁrst three exams in history class. Solving which
inequality gives the score, G, on Tom’s fourth exam that will result in a mean score
on all four exams of at least 90 ?","['A. ', 'B. ', 'C. ', 'D. ID: df32b09c Answer']",['C'],,
e1248a5c,"In the system of equations below, a and c are constants.
If the system of equations has an inﬁnite number of solutions 
, what is the
value of a ?","['A. ', 'B. 0', 'C. ', 'D. ID: e1248a5c Answer']",['D'],,
b8cbe394,"Sean rents a tent at a cost of 
 per day plus a onetime insurance fee of 
. Which equation represents the total cost , in
dollars, to rent the tent with insurance for  days?","['A. ', 'B. ', 'C. ', 'D. ID: b8cbe394 Answer']",['C'],,
05bb1af9,"The graph of 
 is shown. Which equation deﬁnes function ?","['A. ', 'B. ', 'C. ', 'D. ID: 05bb1af9 Answer']",['A'],,
cc7ffe02,"Keenan made 
 cups of vegetable broth. Keenan then ﬁlled  small jars and  large jars with all the vegetable broth he
made. The equation 
 represents this situation. Which is the best interpretation of 
 in this context?","['A. The number of large jars Keenan ﬁlled', 'B. The number of small jars Keenan ﬁlled', 'C. The total number of cups of vegetable broth in the large jars', 'D. The total number of cups of vegetable broth in the small jars']",['C'],,
dae126d7,"The boiling point of water at sea level is 212 degrees Fahrenheit 
. For every
550 feet above sea level, the boiling point of water is lowered by about 
. Which
of the following equations can be used to ﬁnd the boiling point B of water, in 
, x
feet above sea level?","['A. ', 'B. ', 'C. ', 'D. ID: dae126d7 Answer']",['D'],,
bf5f80c6,"Which point ( , ) is a solution to the given inequality in the 
-plane?","['A. (\n, )', 'B. ( , )', 'C. ( , )', 'D. ( , ']",['A'],,
12983c1e,"Some values of the linear function f are shown in the table above.
Which of the following deﬁnes f ?","['A. ', 'B. ', 'C. ', 'D. ID: 12983c1e Answer']",['C'],,
8368afd1,"The graph shows the possible combinations of the number of pounds of tangerines and lemons that could be purchased for
 at a certain store. If Melvin purchased lemons and  pounds of tangerines for a total of 
, how many pounds of
lemons did he purchase?","['A. ', 'B. ', 'C. ', 'D. ID: 8368afd1 Answer']",['B'],,
ae2287e2,"A certain product costs a company $65 to make. The product is sold by a
salesperson who earns a commission that is equal to 20% of the sales price of the
product. The proﬁt the company makes for each unit is equal to the sales price
minus the combined cost of making the product and the commission. If the sales
price of the product is $100, which of the following equations gives the number of
units, u, of the product the company sold to make a proﬁt of $6,840 ?","['A. ', 'B. ', 'C. ', 'D. ID: ae2287e2 Answer']",['A'],,
70d9516e,"A bus is traveling at a constant speed along a straight portion of road. The equation 
 gives the distance , in feet
from a road marker, that the bus will be  seconds after passing the marker. How many feet from the marker will the bus be 
seconds after passing the marker?","['A. ', 'B. ', 'C. ', 'D. ID: 70d9516e Answer']",['C'],,
1362ccde,"The solution to the given system of equations is 
. What is the value of 
?
ID: 1362ccde Answer",[],['35'],,
720e51ac,"The cost , in dollars, for a manufacturer to make  rings is represented by the line shown. 
 What is the cost, in dollars, for the manufacturer to make 
 rings?","['A. ', 'B. ', 'C. ', 'D. ID: 720e51ac Answer']",['C'],,
4de87c9a,"more than  times a number  is equal to 
. Which equation represents this situation?","['A. ', 'B. ', 'C. ', 'D. ID: 4de87c9a Answer']",['D'],,
52cb8ea4,"If 
 is the solution to the system of equations above,
what is the value of 
 ?","['A. ', 'B. ', 'C. 5', 'D. 13']",['B'],,
c307283c,What is an equation of the graph shown?,"['A. ', 'B. ', 'C. ', 'D. ID: c307283c Answer']",['C'],,
8adf1335,"A city’s total expense budget for one year was x million dollars. The city budgeted
y million dollars for departmental expenses and 201 million dollars for all other
expenses. Which of the following represents the relationship between x and y in
this context?","['A. ', 'B. ', 'C. ', 'D. ID: 8adf1335 Answer']",['B'],,
9db5b5c1,"The solution to the given system of equations is 
. What is the value of 
?","['A. ', 'B. ', 'C. ', 'D. ID: 9db5b5c1 Answer']",['C'],,
80da233d,"A certain elephant weighs 200 pounds at birth and gains more than 2 but less than
3 pounds per day during its ﬁrst year. Which of the following inequalities
represents all possible weights w, in pounds, for the elephant 365 days after birth?","['A. ', 'B. ', 'C. ', 'D. ID: 80da233d Answer']",['D'],,
271f7e3f,"For the function f deﬁned above, what is the
value of 
 ?","['A. 1', 'B. 2', 'C. ', 'D. ID: 271f7e3f Answer']",['B'],,
70e29454,"In the equation above, a and b are constants. If the equation has inﬁnitely many
solutions, what are the values of a and b ?","['A. and', 'B. and', 'C. and', 'D. and ']",['B'],,
e7b6f0d1,Which equation has the same solution as the given equation?,"['A. ', 'B. ', 'C. ', 'D. ID: e7b6f0d1 Answer', 'C. Since this equation is equivalent to the given equation, it has the same solution as the given equation.']",['C'],,
0b46bad5,"In the equation above, a and b are constants and 
. Which of the following
could represent the graph of the equation in the xy-plane?","['A. ', 'B. ', 'C. ', 'D. ID: 0b46bad5 Answer']",['C'],,
